<?xml version="1.0" encoding="UTF-8"?>
<theme xmlns="http://belog.beldon.me/schema/plugin"
       xmlns:xsi="http://www.w3.org/2001/XMLSchema-instance"
       xsi:schemaLocation="http://belog.beldon.me/schema/plugin
        http://belog.beldon.me/schema/plugin/belog.xsd">

    <name>默认模板</name>
    <author>Beldon</author>
    <email>beldon@beldon.me</email>
    <url>http://beldon.me</url>
    <logo>logo.png</logo>
    <version>1.0</version>
    <description>这是系统默认的模板</description>

    <config>
        <element type="text" key="spfk_email" label="邮箱地址"/>
        <element type="text" key="spfk_github" label="Github"/>
        <element type="text" key="spfk_weibo" label="微博"/>
        <element type="text" key="spfk_zhihu" label="知乎"/>
        <element type="textarea" key="spfk_aboutme" label="关于我"/>
    </config>
</theme>
